2025-08-15 21:36:31,254 - INFO - ================================================================================
2025-08-15 21:36:31,255 - INFO - SAC PENDULUM TRAINING SESSION STARTED
2025-08-15 21:36:31,255 - INFO - ================================================================================
2025-08-15 21:36:31,255 - INFO - HYPERPARAMETERS:
2025-08-15 21:36:31,255 - INFO - ----------------------------------------
2025-08-15 21:36:31,255 - INFO - batch_size               : 256
2025-08-15 21:36:31,255 - INFO - buffer_size              : 50000
2025-08-15 21:36:31,255 - INFO - ent_coef                 : auto
2025-08-15 21:36:31,255 - INFO - episode_length           : 200
2025-08-15 21:36:31,255 - INFO - fixed_target             : None
2025-08-15 21:36:31,255 - INFO - gamma                    : 0.95
2025-08-15 21:36:31,255 - INFO - gradient_steps           : 1
2025-08-15 21:36:31,255 - INFO - gui                      : False
2025-08-15 21:36:31,255 - INFO - learning_rate            : 0.0003
2025-08-15 21:36:31,255 - INFO - learning_starts          : 1000
2025-08-15 21:36:31,255 - INFO - log_interval             : 50
2025-08-15 21:36:31,256 - INFO - max_steps                : 200
2025-08-15 21:36:31,256 - INFO - normalize_states         : True
2025-08-15 21:36:31,256 - INFO - policy_layers            : [64, 64]
2025-08-15 21:36:31,256 - INFO - qf_layers                : [64, 64]
2025-08-15 21:36:31,256 - INFO - record                   : False
2025-08-15 21:36:31,256 - INFO - record_best_episodes     : True
2025-08-15 21:36:31,256 - INFO - recording_fps            : 30
2025-08-15 21:36:31,256 - INFO - save_interval            : 10000
2025-08-15 21:36:31,256 - INFO - target_update_interval   : 1
2025-08-15 21:36:31,256 - INFO - tau                      : 0.005
2025-08-15 21:36:31,256 - INFO - total_timesteps          : 300000
2025-08-15 21:36:31,256 - INFO - train_freq               : 1
2025-08-15 21:36:31,256 - INFO - use_sde                  : False
2025-08-15 21:36:31,256 - INFO - ----------------------------------------
2025-08-15 21:36:31,256 - INFO - Log file: /home/osos/Mohamed_Masters_Thesis/DHP_pendulum/training_logs/sac_pendulum_training_20250815_213631.log
2025-08-15 21:36:31,256 - INFO - ================================================================================
2025-08-15 21:36:31,257 - INFO - 
CONFIGURATION OVERRIDES APPLIED:
2025-08-15 21:36:31,257 - INFO -   total_timesteps: 300000
2025-08-15 21:36:31,257 - INFO -   episode_length: 200
2025-08-15 21:36:31,257 - INFO -   max_steps: 200
2025-08-15 21:36:31,257 - INFO -   log_interval: 50
2025-08-15 21:36:31,257 - INFO -   save_interval: 10000
2025-08-15 21:36:31,257 - INFO -   gui: False
2025-08-15 21:36:31,257 - INFO -   record: False
2025-08-15 21:36:31,257 - INFO -   normalize_states: True
2025-08-15 21:36:31,257 - INFO -   record_best_episodes: True
2025-08-15 21:36:31,257 - INFO -   learning_rate: 0.0003
2025-08-15 21:36:31,257 - INFO -   buffer_size: 50000
2025-08-15 21:36:31,257 - INFO -   batch_size: 256
2025-08-15 21:36:31,257 - INFO -   gamma: 0.95
2025-08-15 21:36:31,257 - INFO -   tau: 0.005
2025-08-15 21:36:31,258 - INFO -   ent_coef: auto
2025-08-15 21:36:31,258 - INFO -   learning_starts: 1000
2025-08-15 21:36:31,258 - INFO -   policy_layers: [64, 64]
2025-08-15 21:36:31,258 - INFO -   qf_layers: [64, 64]
2025-08-15 21:36:31,258 - INFO - 
==================================================
2025-08-15 21:36:31,258 - INFO - STARTING SAC TRAINING FOR PENDULUM
2025-08-15 21:36:31,258 - INFO - ==================================================
2025-08-15 21:36:31,285 - INFO - 
Training for 300000 timesteps...
2025-08-15 21:36:31,285 - INFO - This corresponds to approximately 1500 episodes of 200 steps each
2025-08-15 21:38:31,983 - INFO - NEW BEST PERFORMANCE! Episode 50: 0.7359 rad
2025-08-15 21:38:31,999 - INFO - BEST MODEL SAVED! Episode 50, Error: 0.7359 rad
2025-08-15 21:38:31,999 - INFO - Best model path: /home/osos/Mohamed_Masters_Thesis/DHP_pendulum/trained_models/sac_pendulum_best
2025-08-15 21:38:31,999 - INFO -      50 | -290.66 |    6.903 |    0.7359 |   0.000 |  120.7s
2025-08-15 21:38:32,001 - ERROR - Environment reset error at episode 50. Attempting to recover...
2025-08-15 21:38:32,001 - INFO - Environment reset successful, continuing training...
2025-08-15 21:40:41,283 - INFO - NEW BEST PERFORMANCE! Episode 100: 0.0988 rad
2025-08-15 21:40:41,297 - INFO - BEST MODEL SAVED! Episode 100, Error: 0.0988 rad
2025-08-15 21:40:41,297 - INFO - Best model path: /home/osos/Mohamed_Masters_Thesis/DHP_pendulum/trained_models/sac_pendulum_best
2025-08-15 21:40:41,297 - INFO - CONVERGENCE EPISODE 100: 0.0988 rad
2025-08-15 21:40:41,297 - INFO -     100 | -137.80 |   34.609 |    0.0988 |   1.000 |  250.0s
2025-08-15 21:40:41,299 - ERROR - Environment reset error at episode 100. Attempting to recover...
2025-08-15 21:40:41,300 - INFO - Environment reset successful, continuing training...
2025-08-15 21:42:46,213 - INFO -     150 | -1067.07 |   21.858 |    2.5988 |   0.000 |  374.9s
2025-08-15 21:42:46,215 - ERROR - Environment reset error at episode 150. Attempting to recover...
2025-08-15 21:42:46,216 - INFO - Environment reset successful, continuing training...
2025-08-15 21:44:53,344 - INFO -     200 | -615.45 |    9.690 |    1.4356 |   0.000 |  502.1s
2025-08-15 21:44:53,345 - ERROR - Environment reset error at episode 200. Attempting to recover...
2025-08-15 21:44:53,346 - INFO - Environment reset successful, continuing training...
2025-08-15 21:47:03,023 - INFO -     250 | -1016.99 |   38.898 |    2.1505 |   0.000 |  631.7s
2025-08-15 21:47:03,024 - ERROR - Environment reset error at episode 250. Attempting to recover...
2025-08-15 21:47:03,025 - INFO - Environment reset successful, continuing training...
2025-08-15 21:49:15,529 - INFO -     300 | -1076.43 |   37.593 |    2.4919 |   0.000 |  764.2s
2025-08-15 21:49:15,530 - ERROR - Environment reset error at episode 300. Attempting to recover...
2025-08-15 21:49:15,531 - INFO - Environment reset successful, continuing training...
2025-08-15 21:51:23,473 - INFO - CONVERGENCE EPISODE 350: 0.1259 rad
2025-08-15 21:51:23,473 - INFO -     350 | -280.85 |    9.847 |    0.1259 |   0.000 |  892.2s
2025-08-15 21:51:23,475 - ERROR - Environment reset error at episode 350. Attempting to recover...
2025-08-15 21:51:23,476 - INFO - Environment reset successful, continuing training...
2025-08-15 21:53:31,379 - INFO - CONVERGENCE EPISODE 400: 0.4259 rad
2025-08-15 21:53:31,379 - INFO -     400 |  -52.43 |    2.319 |    0.4259 |   0.000 | 1020.1s
2025-08-15 21:53:31,381 - ERROR - Environment reset error at episode 400. Attempting to recover...
2025-08-15 21:53:31,382 - INFO - Environment reset successful, continuing training...
2025-08-15 21:55:37,307 - INFO - CONVERGENCE EPISODE 450: 0.1548 rad
2025-08-15 21:55:37,307 - INFO -     450 |   -5.78 |    0.612 |    0.1548 |   0.000 | 1146.0s
2025-08-15 21:55:37,308 - ERROR - Environment reset error at episode 450. Attempting to recover...
2025-08-15 21:55:37,310 - INFO - Environment reset successful, continuing training...
2025-08-15 21:57:41,975 - INFO -     500 | -249.57 |    5.057 |    0.8702 |   0.000 | 1270.7s
2025-08-15 21:57:41,976 - ERROR - Environment reset error at episode 500. Attempting to recover...
2025-08-15 21:57:41,977 - INFO - Environment reset successful, continuing training...
2025-08-15 21:59:46,060 - INFO -     550 | -574.47 |    8.051 |    1.5057 |   0.000 | 1394.8s
2025-08-15 21:59:46,061 - ERROR - Environment reset error at episode 550. Attempting to recover...
2025-08-15 21:59:46,062 - INFO - Environment reset successful, continuing training...
2025-08-15 22:01:54,675 - INFO -     600 | -440.73 |    4.431 |    1.4873 |   0.000 | 1523.4s
2025-08-15 22:01:54,676 - ERROR - Environment reset error at episode 600. Attempting to recover...
2025-08-15 22:01:54,677 - INFO - Environment reset successful, continuing training...
2025-08-15 22:04:04,667 - INFO -     650 | -190.45 |    4.781 |    0.6086 |   0.000 | 1653.4s
2025-08-15 22:04:04,669 - ERROR - Environment reset error at episode 650. Attempting to recover...
2025-08-15 22:04:04,669 - INFO - Environment reset successful, continuing training...
2025-08-15 22:06:15,020 - INFO -     700 | -180.41 |    5.215 |    0.5809 |   0.000 | 1783.7s
2025-08-15 22:06:15,021 - ERROR - Environment reset error at episode 700. Attempting to recover...
2025-08-15 22:06:15,022 - INFO - Environment reset successful, continuing training...
2025-08-15 22:08:19,445 - INFO -     750 | -835.39 |   14.856 |    1.0535 |   0.000 | 1908.2s
2025-08-15 22:08:19,447 - ERROR - Environment reset error at episode 750. Attempting to recover...
2025-08-15 22:08:19,447 - INFO - Environment reset successful, continuing training...
2025-08-15 22:10:26,703 - INFO -     800 | -506.63 |    6.039 |    1.5307 |   0.000 | 2035.4s
2025-08-15 22:10:26,704 - ERROR - Environment reset error at episode 800. Attempting to recover...
2025-08-15 22:10:26,705 - INFO - Environment reset successful, continuing training...
2025-08-15 22:12:31,641 - INFO -     850 | -106.33 |    1.506 |    0.6717 |   0.000 | 2160.4s
2025-08-15 22:12:31,642 - ERROR - Environment reset error at episode 850. Attempting to recover...
2025-08-15 22:12:31,643 - INFO - Environment reset successful, continuing training...
2025-08-15 22:14:42,217 - INFO -     900 | -268.46 |    1.410 |    1.1812 |   0.000 | 2290.9s
2025-08-15 22:14:42,218 - ERROR - Environment reset error at episode 900. Attempting to recover...
2025-08-15 22:14:42,219 - INFO - Environment reset successful, continuing training...
2025-08-15 22:16:51,249 - INFO - CONVERGENCE EPISODE 950: 0.1646 rad
2025-08-15 22:16:51,249 - INFO -     950 |  -17.70 |    1.644 |    0.1646 |   0.000 | 2420.0s
2025-08-15 22:16:51,250 - ERROR - Environment reset error at episode 950. Attempting to recover...
2025-08-15 22:16:51,252 - INFO - Environment reset successful, continuing training...
2025-08-15 22:18:37,958 - INFO -    1000 | -202.92 |    5.329 |    0.6609 |   0.000 | 2526.7s
2025-08-15 22:18:37,959 - ERROR - Environment reset error at episode 1000. Attempting to recover...
2025-08-15 22:18:37,961 - INFO - Environment reset successful, continuing training...
2025-08-15 22:20:23,819 - INFO -    1050 | -298.57 |    3.083 |    1.1041 |   0.000 | 2632.5s
2025-08-15 22:20:23,820 - ERROR - Environment reset error at episode 1050. Attempting to recover...
2025-08-15 22:20:23,820 - INFO - Environment reset successful, continuing training...
2025-08-15 22:22:10,239 - INFO - NEW BEST PERFORMANCE! Episode 1100: 0.0207 rad
2025-08-15 22:22:10,254 - INFO - BEST MODEL SAVED! Episode 1100, Error: 0.0207 rad
2025-08-15 22:22:10,254 - INFO - Best model path: /home/osos/Mohamed_Masters_Thesis/DHP_pendulum/trained_models/sac_pendulum_best
2025-08-15 22:22:10,254 - INFO - CONVERGENCE EPISODE 1100: 0.0207 rad
2025-08-15 22:22:10,254 - INFO -    1100 |  -57.04 |    4.890 |    0.0207 |   1.000 | 2739.0s
2025-08-15 22:22:10,255 - ERROR - Environment reset error at episode 1100. Attempting to recover...
2025-08-15 22:22:10,256 - INFO - Environment reset successful, continuing training...
2025-08-15 22:23:57,024 - INFO -    1150 | -128.33 |    4.346 |    0.6186 |   0.000 | 2845.7s
2025-08-15 22:23:57,025 - ERROR - Environment reset error at episode 1150. Attempting to recover...
2025-08-15 22:23:57,026 - INFO - Environment reset successful, continuing training...
2025-08-15 22:25:41,629 - INFO - CONVERGENCE EPISODE 1200: 0.4088 rad
2025-08-15 22:25:41,629 - INFO -    1200 |  -89.55 |    4.948 |    0.4088 |   0.000 | 2950.3s
2025-08-15 22:25:41,630 - ERROR - Environment reset error at episode 1200. Attempting to recover...
2025-08-15 22:25:41,631 - INFO - Environment reset successful, continuing training...
2025-08-15 22:27:26,611 - INFO - CONVERGENCE EPISODE 1250: 0.2216 rad
2025-08-15 22:27:26,611 - INFO -    1250 |  -30.61 |    2.465 |    0.2216 |   0.000 | 3055.3s
2025-08-15 22:27:26,613 - ERROR - Environment reset error at episode 1250. Attempting to recover...
2025-08-15 22:27:26,614 - INFO - Environment reset successful, continuing training...
2025-08-15 22:29:13,728 - INFO - CONVERGENCE EPISODE 1300: 0.3691 rad
2025-08-15 22:29:13,729 - INFO -    1300 | -131.84 |    3.532 |    0.3691 |   0.000 | 3162.4s
2025-08-15 22:29:13,731 - ERROR - Environment reset error at episode 1300. Attempting to recover...
2025-08-15 22:29:13,732 - INFO - Environment reset successful, continuing training...
2025-08-15 22:31:01,391 - INFO -    1350 | -257.53 |    2.145 |    1.0921 |   0.000 | 3270.1s
2025-08-15 22:31:01,393 - ERROR - Environment reset error at episode 1350. Attempting to recover...
2025-08-15 22:31:01,394 - INFO - Environment reset successful, continuing training...
2025-08-15 22:32:47,858 - INFO -    1400 | -308.15 |    1.681 |    1.3157 |   0.000 | 3376.6s
2025-08-15 22:32:47,859 - ERROR - Environment reset error at episode 1400. Attempting to recover...
2025-08-15 22:32:47,860 - INFO - Environment reset successful, continuing training...
2025-08-15 22:34:35,643 - INFO - CONVERGENCE EPISODE 1450: 0.0370 rad
2025-08-15 22:34:35,643 - INFO -    1450 |  -37.31 |    3.916 |    0.0370 |   1.000 | 3484.4s
2025-08-15 22:34:35,644 - ERROR - Environment reset error at episode 1450. Attempting to recover...
2025-08-15 22:34:35,645 - INFO - Environment reset successful, continuing training...
2025-08-15 22:36:20,693 - INFO -    1500 | -411.50 |    6.507 |    1.2784 |   0.000 | 3589.4s
2025-08-15 22:36:20,693 - INFO - 
================================================================================
2025-08-15 22:36:20,693 - INFO - TRAINING COMPLETED - FINAL ANALYSIS
2025-08-15 22:36:20,693 - INFO - ================================================================================
2025-08-15 22:36:20,693 - INFO - Total training time: 3589.4 seconds (59.8 minutes)
2025-08-15 22:36:20,693 - INFO - Final episode reward: -411.50
2025-08-15 22:36:20,693 - INFO - Final position error: 1.2784 rad
2025-08-15 22:36:20,693 - INFO - Final success rate: 0.000
2025-08-15 22:36:20,693 - INFO - Best position error achieved: 0.0207 rad at episode 1100
2025-08-15 22:36:20,693 - INFO - Total convergent episodes (< 0.5 rad): 10/30 (33.33%)
2025-08-15 22:36:20,693 - INFO - Recent success rate (last 100 episodes): 10.00%
2025-08-15 22:36:20,694 - INFO - Training metrics saved to: /home/osos/Mohamed_Masters_Thesis/DHP_pendulum/training_logs/sac_pendulum_metrics_20250815_223620.json
2025-08-15 22:36:20,714 - INFO - Model saved with state normalization ENABLED
2025-08-16 00:48:33,375 - INFO - 
==================================================
2025-08-16 00:48:33,376 - INFO - STARTING POLICY DEMONSTRATION
2025-08-16 00:48:33,376 - INFO - ==================================================
2025-08-16 00:48:40,374 - INFO - Demonstration final angle error: 170.8°
2025-08-16 00:48:40,374 - INFO - Training and demonstration session completed successfully!
